{
  "ok": true,
  "claim": "circuit_identity_after_layout",
  "claimed_link": "manifest_checked_theorem_binding",
  "lean_module": "QSpecBench.Quantum.OpenQASM3",
  "lean_theorem": "bridge_circuit_identity_after_layout",
  "qasm": "C:\\Users\\mateo\\QSpecBench\\benchmarks\\equivalence\\circuit_identity_after_layout\\artifacts\\source.qasm",
  "n_qubits": 2,
  "gates": 2,
  "matrix_match": true,
  "errors": []
}
