{
  "ok": true,
  "claim": "cnot_self_inverse_cancellation",
  "claimed_link": "kernel_checked_codegen_trace",
  "lean_module": "QSpecBench.Quantum.OpenQASM3",
  "lean_theorem": "bridge_cnot_codegen_self_inverse",
  "qasm": "C:\\Users\\mateo\\QSpecBench\\benchmarks\\equivalence\\cnot_self_inverse_cancellation\\artifacts\\source.qasm",
  "n_qubits": 2,
  "gates": 2,
  "matrix_match": true,
  "errors": []
}
