{
  "ok": true,
  "claim": "teleportation_preserves_state_up_to_pauli_correction",
  "claimed_link": "kernel_checked_artifact_semantics",
  "lean_module": "QSpecBench.Quantum.OpenQASM3",
  "lean_theorem": "bridge_teleport_unitary_prefix_codegen",
  "qasm": "C:\\Users\\mateo\\QSpecBench\\benchmarks\\algorithms\\teleportation_preserves_state_up_to_pauli_correction\\artifacts\\teleport_unitary_prefix.qasm",
  "n_qubits": 3,
  "gates": 4,
  "matrix_match": true,
  "errors": []
}
