{
  "ok": true,
  "claim": "bell_state_preparation",
  "claimed_link": "manifest_checked_theorem_binding",
  "lean_module": "QSpecBench.Quantum.OpenQASM3",
  "lean_theorem": "bridge_bell_prep",
  "qasm": "C:\\Users\\mateo\\QSpecBench\\benchmarks\\algorithms\\bell_state_preparation\\artifacts\\circuit.qasm",
  "n_qubits": 2,
  "gates": 2,
  "matrix_match": true,
  "errors": []
}
